[
 {
  "id": "gpt-4o",
  "name": "GPT-4o",
  "provider": "OpenAI",
  "family": "GPT-4o",
  "capabilities": [
   "tool_use",
   "vision",
   "reasoning",
   "safety",
   "free"
  ],
  "free": true,
  "tool_use": true,
  "quality": 8.1,
  "latency_ms": 2201,
  "cost_per_mtok": 0.0,
  "context_k": 0,
  "modality": "text",
  "locality": "local",
  "privacy": 9,
  "availability": 10
 },
 {
  "id": "gpt-4o-mini",
  "name": "GPT-4o-mini",
  "provider": "OpenAI",
  "family": "GPT-4o",
  "capabilities": [
   "tool_use",
   "vision",
   "reasoning",
   "safety"
  ],
  "free": false,
  "tool_use": true,
  "quality": 8.5,
  "latency_ms": 2410,
  "cost_per_mtok": 0.93,
  "context_k": 256,
  "modality": "text",
  "locality": "hybrid",
  "privacy": 7,
  "availability": 6
 },
 {
  "id": "gpt-4o-small",
  "name": "GPT-4o-small",
  "provider": "OpenAI",
  "family": "GPT-4o",
  "capabilities": [
   "tool_use",
   "vision",
   "reasoning",
   "safety"
  ],
  "free": false,
  "tool_use": true,
  "quality": 4.6,
  "latency_ms": 1116,
  "cost_per_mtok": 14.92,
  "context_k": 32,
  "modality": "text",
  "locality": "cloud",
  "privacy": 8,
  "availability": 6
 },
 {
  "id": "gpt-4o-8b",
  "name": "GPT-4o-8B",
  "provider": "OpenAI",
  "family": "GPT-4o",
  "capabilities": [
   "tool_use",
   "vision",
   "reasoning",
   "safety",
   "free"
  ],
  "free": true,
  "tool_use": true,
  "quality": 5.3,
  "latency_ms": 2116,
  "cost_per_mtok": 0.0,
  "context_k": 32,
  "modality": "text",
  "locality": "local",
  "privacy": 6,
  "availability": 10
 },
 {
  "id": "gpt-4o-70b",
  "name": "GPT-4o-70B",
  "provider": "OpenAI",
  "family": "GPT-4o",
  "capabilities": [
   "tool_use",
   "vision",
   "reasoning",
   "safety"
  ],
  "free": false,
  "tool_use": true,
  "quality": 6.9,
  "latency_ms": 267,
  "cost_per_mtok": 14.61,
  "context_k": 2000,
  "modality": "text",
  "locality": "local",
  "privacy": 5,
  "availability": 10
 },
 {
  "id": "gpt-4o-turbo",
  "name": "GPT-4o-turbo",
  "provider": "OpenAI",
  "family": "GPT-4o",
  "capabilities": [
   "tool_use",
   "vision",
   "reasoning",
   "safety"
  ],
  "free": false,
  "tool_use": true,
  "quality": 4.8,
  "latency_ms": 1511,
  "cost_per_mtok": 6.48,
  "context_k": 8,
  "modality": "text",
  "locality": "local",
  "privacy": 3,
  "availability": 6
 },
 {
  "id": "gpt-4o-pro",
  "name": "GPT-4o-pro",
  "provider": "OpenAI",
  "family": "GPT-4o",
  "capabilities": [
   "tool_use",
   "vision",
   "reasoning",
   "safety",
   "free"
  ],
  "free": true,
  "tool_use": true,
  "quality": 4.7,
  "latency_ms": 2351,
  "cost_per_mtok": 0.0,
  "context_k": 8,
  "modality": "text",
  "locality": "cloud",
  "privacy": 3,
  "availability": 6
 },
 {
  "id": "gpt-4o-ultra",
  "name": "GPT-4o-ultra",
  "provider": "OpenAI",
  "family": "GPT-4o",
  "capabilities": [
   "tool_use",
   "vision",
   "reasoning",
   "safety"
  ],
  "free": false,
  "tool_use": true,
  "quality": 6.2,
  "latency_ms": 1856,
  "cost_per_mtok": 4.72,
  "context_k": 128,
  "modality": "text",
  "locality": "local",
  "privacy": 3,
  "availability": 6
 },
 {
  "id": "gpt-4o-q4",
  "name": "GPT-4o-Q4",
  "provider": "OpenAI",
  "family": "GPT-4o",
  "capabilities": [
   "tool_use",
   "vision",
   "reasoning",
   "safety"
  ],
  "free": false,
  "tool_use": true,
  "quality": 7.3,
  "latency_ms": 1968,
  "cost_per_mtok": 3.38,
  "context_k": 8,
  "modality": "text",
  "locality": "cloud",
  "privacy": 9,
  "availability": 6
 },
 {
  "id": "gpt-4o-q8",
  "name": "GPT-4o-Q8",
  "provider": "OpenAI",
  "family": "GPT-4o",
  "capabilities": [
   "tool_use",
   "vision",
   "reasoning",
   "safety",
   "free"
  ],
  "free": true,
  "tool_use": true,
  "quality": 4.1,
  "latency_ms": 1692,
  "cost_per_mtok": 0.0,
  "context_k": 1000,
  "modality": "text",
  "locality": "local",
  "privacy": 9,
  "availability": 10
 },
 {
  "id": "gpt-4o-mini",
  "name": "GPT-4o-mini",
  "provider": "OpenAI",
  "family": "GPT-4o-mini",
  "capabilities": [
   "tool_use",
   "vision",
   "web",
   "free"
  ],
  "free": true,
  "tool_use": true,
  "quality": 6.8,
  "latency_ms": 1292,
  "cost_per_mtok": 0.0,
  "context_k": 16,
  "modality": "text",
  "locality": "local",
  "privacy": 5,
  "availability": 6
 },
 {
  "id": "gpt-4o-mini-mini",
  "name": "GPT-4o-mini-mini",
  "provider": "OpenAI",
  "family": "GPT-4o-mini",
  "capabilities": [
   "tool_use",
   "vision",
   "web"
  ],
  "free": false,
  "tool_use": true,
  "quality": 7.6,
  "latency_ms": 1203,
  "cost_per_mtok": 12.93,
  "context_k": 128,
  "modality": "text",
  "locality": "hybrid",
  "privacy": 8,
  "availability": 8
 },
 {
  "id": "gpt-4o-mini-small",
  "name": "GPT-4o-mini-small",
  "provider": "OpenAI",
  "family": "GPT-4o-mini",
  "capabilities": [
   "tool_use",
   "vision",
   "web"
  ],
  "free": false,
  "tool_use": true,
  "quality": 9.2,
  "latency_ms": 747,
  "cost_per_mtok": 10.69,
  "context_k": 32,
  "modality": "text",
  "locality": "cloud",
  "privacy": 9,
  "availability": 9
 },
 {
  "id": "gpt-4o-mini-8b",
  "name": "GPT-4o-mini-8B",
  "provider": "OpenAI",
  "family": "GPT-4o-mini",
  "capabilities": [
   "tool_use",
   "vision",
   "web",
   "free"
  ],
  "free": true,
  "tool_use": true,
  "quality": 5.3,
  "latency_ms": 920,
  "cost_per_mtok": 0.0,
  "context_k": 64,
  "modality": "text",
  "locality": "cloud",
  "privacy": 7,
  "availability": 10
 },
 {
  "id": "gpt-4o-mini-70b",
  "name": "GPT-4o-mini-70B",
  "provider": "OpenAI",
  "family": "GPT-4o-mini",
  "capabilities": [
   "tool_use",
   "vision",
   "web"
  ],
  "free": false,
  "tool_use": true,
  "quality": 4.4,
  "latency_ms": 915,
  "cost_per_mtok": 6.22,
  "context_k": 32,
  "modality": "text",
  "locality": "hybrid",
  "privacy": 7,
  "availability": 10
 },
 {
  "id": "gpt-4o-mini-turbo",
  "name": "GPT-4o-mini-turbo",
  "provider": "OpenAI",
  "family": "GPT-4o-mini",
  "capabilities": [
   "tool_use",
   "vision",
   "web"
  ],
  "free": false,
  "tool_use": true,
  "quality": 7.2,
  "latency_ms": 218,
  "cost_per_mtok": 14.24,
  "context_k": 16,
  "modality": "text",
  "locality": "hybrid",
  "privacy": 9,
  "availability": 10
 },
 {
  "id": "gpt-4o-mini-pro",
  "name": "GPT-4o-mini-pro",
  "provider": "OpenAI",
  "family": "GPT-4o-mini",
  "capabilities": [
   "tool_use",
   "vision",
   "web",
   "free"
  ],
  "free": true,
  "tool_use": true,
  "quality": 5.5,
  "latency_ms": 573,
  "cost_per_mtok": 0.0,
  "context_k": 1000,
  "modality": "text",
  "locality": "hybrid",
  "privacy": 3,
  "availability": 10
 },
 {
  "id": "gpt-4o-mini-ultra",
  "name": "GPT-4o-mini-ultra",
  "provider": "OpenAI",
  "family": "GPT-4o-mini",
  "capabilities": [
   "tool_use",
   "vision",
   "web"
  ],
  "free": false,
  "tool_use": true,
  "quality": 4.8,
  "latency_ms": 1103,
  "cost_per_mtok": 1.5,
  "context_k": 256,
  "modality": "text",
  "locality": "local",
  "privacy": 5,
  "availability": 7
 },
 {
  "id": "gpt-4o-mini-q4",
  "name": "GPT-4o-mini-Q4",
  "provider": "OpenAI",
  "family": "GPT-4o-mini",
  "capabilities": [
   "tool_use",
   "vision",
   "web"
  ],
  "free": false,
  "tool_use": true,
  "quality": 4.7,
  "latency_ms": 468,
  "cost_per_mtok": 7.19,
  "context_k": 256,
  "modality": "text",
  "locality": "cloud",
  "privacy": 3,
  "availability": 6
 },
 {
  "id": "gpt-4o-mini-q8",
  "name": "GPT-4o-mini-Q8",
  "provider": "OpenAI",
  "family": "GPT-4o-mini",
  "capabilities": [
   "tool_use",
   "vision",
   "web",
   "free"
  ],
  "free": true,
  "tool_use": true,
  "quality": 9.2,
  "latency_ms": 2255,
  "cost_per_mtok": 0.0,
  "context_k": 256,
  "modality": "text",
  "locality": "hybrid",
  "privacy": 4,
  "availability": 7
 },
 {
  "id": "o1",
  "name": "o1",
  "provider": "OpenAI",
  "family": "o1",
  "capabilities": [
   "reasoning",
   "code",
   "free"
  ],
  "free": true,
  "tool_use": false,
  "quality": 4.1,
  "latency_ms": 2327,
  "cost_per_mtok": 0.0,
  "context_k": 32,
  "modality": "text",
  "locality": "local",
  "privacy": 8,
  "availability": 8
 },
 {
  "id": "o1-mini",
  "name": "o1-mini",
  "provider": "OpenAI",
  "family": "o1",
  "capabilities": [
   "reasoning",
   "code"
  ],
  "free": false,
  "tool_use": false,
  "quality": 4.7,
  "latency_ms": 856,
  "cost_per_mtok": 8.44,
  "context_k": 0,
  "modality": "text",
  "locality": "cloud",
  "privacy": 9,
  "availability": 9
 },
 {
  "id": "o1-small",
  "name": "o1-small",
  "provider": "OpenAI",
  "family": "o1",
  "capabilities": [
   "reasoning",
   "code"
  ],
  "free": false,
  "tool_use": false,
  "quality": 5.0,
  "latency_ms": 781,
  "cost_per_mtok": 6.55,
  "context_k": 64,
  "modality": "text",
  "locality": "local",
  "privacy": 7,
  "availability": 7
 },
 {
  "id": "o1-8b",
  "name": "o1-8B",
  "provider": "OpenAI",
  "family": "o1",
  "capabilities": [
   "reasoning",
   "code",
   "free"
  ],
  "free": true,
  "tool_use": false,
  "quality": 8.3,
  "latency_ms": 843,
  "cost_per_mtok": 0.0,
  "context_k": 128,
  "modality": "text",
  "locality": "cloud",
  "privacy": 5,
  "availability": 10
 },
 {
  "id": "o1-70b",
  "name": "o1-70B",
  "provider": "OpenAI",
  "family": "o1",
  "capabilities": [
   "reasoning",
   "code"
  ],
  "free": false,
  "tool_use": false,
  "quality": 5.3,
  "latency_ms": 157,
  "cost_per_mtok": 7.84,
  "context_k": 32,
  "modality": "text",
  "locality": "hybrid",
  "privacy": 9,
  "availability": 8
 },
 {
  "id": "o1-turbo",
  "name": "o1-turbo",